{
	"title": "Schema for UniCert certificates",
	"description": "This schema describes the format of a UniCert certificate in JSON format",
	"type":"object",
	"$schema": "http://json-schema.org/draft-04/schema",
	"properties": {
		"commonName": {
			"type": "string",
			"description": "Common name of certificate owner"
		},	
		"uniqueIdentifier": {
			"type": "string",
			"description":  "Unique identifier of certificate owner"
		},
		"organisation": {
			"type": "string",
			"description": "Organisation of certificate owner"
		},
		"organisationUnit": {
			"type": "string",
			"description": "Organisation unit of certificate owner"
		},
		"countryName": {
			"type": "string",
			"description": "Country of certificate owner"
		},
		"state": {
			"type": "string",
			"description": "State of certificate owner"
		},
		"locality": {
			"type": "string",
			"description": "Locality certificate owner"
		},
		"surname": {
			"type": "string",
			"description": "Surname of certificate owner"
		},
		"givenName": {
			"type": "string",
			"description": "Given name of certificate owner"
		},
	   	"issuer": {
			"type": "string",
			"description": "Issuer of the certificate"
		},
		"serialNumber": {
			"type":"string",
			"description": "Serial number of the certificate"
		},
		"validFrom": {
			"type": "string",
			"description": "Date when certificate starts to be valid"
		},
		"validUntil": {
			"type": "string",
			"description": "Date when certificate stops to be valid"
		}, 
		"applicationIdentifier": {
			"type": "string",
			"description": "Application the certificate has been issued for"
		},
		"roles": {
			"type":"array",
			"description": "Role inside an application the certificate has been issued for",
			"items": {
				"type":"string"
			}
		},
		"identityProvider": {
			"type": "string",
			"description": "Identity provider used to verify the identity of the certificate owner"
		},
		"pem": {
			"type": "string",
			"description": "Certificate in PEM format"
		}
	},
	"additionalProperties": false,
	"required": ["commonName", "issuer", "serialNumber", "validFrom", "validUntil", "identityProvider", "pem" ]
}
