[
	{
		"commonName": "XXXXXXXXX",
		"uniqueIdentifier": "XXXXXXXXXXX",
		"organisation": "bfh.ch",
		"issuer": "CN=UniCert BFH",
		"serialNumber": "765428343514349",
		"validFrom": "2015-06-22T12:35:42.000+0000",
		"validUntil": "2025-06-22T12:35:42.000+0000",
		"applicationIdentifier": "UniVote",
		"roles": [ "Voter" ],
		"identityProvider": "SwitchAAI",
		"pem": "UsAMBYxFDASBWQWFgNasdVBAMMnCdfZIMB4XDTE1MDYyMjEjEAWUWQyMzU0MloXDTI1MDYyMfjEyMzUigM"
	},
	{
		"commonName": "XXXXXXXXX",
		"uniqueIdentifier": "XXXXXXXXXXX",
		"organisation": "bfh.ch",
		"issuer": "CN=UniCert BFH",
		"serialNumber": "765428343514349",
		"validFrom": "2015-06-22T12:35:42.000+0000",
		"validUntil": "2025-06-22T12:35:42.000+0000",
		"applicationIdentifier": "UniVote",
		"roles": [ "Voter" ],
		"identityProvider": "SwitchAAI",
		"pem": "UsAMBYxFDASBWQWFgNasdVBAMMnCdfZIMB4XDTE1MDYyMjEjEAWUWQyMzU0MloXDTI1MDYyMfjEyMzUigM"
	}
]
