{
	"commonName": "XXXXXXXXX",
	"uniqueIdentifier": "XXXXXXXXXXX",
	"organisation": "bfh.ch",
	"issuer": "CN=UniCert BFH",
	"serialNumber": "765428343514349",
	"validFrom": "2015-06-22T12:35:42Z",
	"validUntil": "2025-06-22T12:35:42Z",
	"applicationIdentifier": "UniVote",
	"roles": ["Voter"],
	"identityProvider": "SwitchAAI",
	"pem": "UsAMBYxFDASBWQWFgNasdVBAMMnCdfZIMB4XDTE1MDYyMjEjEAWUWQyMzU0MloXDTI1MDYyMfjEyMzUigM"
}
